446	Marmok	Gaming and entertainment channel, possibly featuring gameplay and comedic commentary.	Russian	18500000	3457618361	Gaming	Marmok	374	Russia	RU	Games	2356	5	32	38282000	9600	153100	114800	1800000	0	2008	Apr	27	819	144373535	459	107683889	6152401	105318756
447	The ACE Family	Family vlog channel documenting the life of the former basketball player Austin McBroom and his family.	English	18500000	4558380251	People & Blogs	The ACE Family	712	United States	US	People	1572		25	2835000	709	11300	8500	136100	0	2016	Jan	10	882	328239523	147	270663028	3709024	-95712891
448	Like Nastya Vlog	Vlog and adventure channel featuring a young girl named Nastya and her family.	Russian	18500000	8147575884	People & Blogs	Like Nastya Vlog	493	Russia	RU	People	630	5	25	48947000	12200	195800	146800	2300000	0	2016	Jan	14	819	144373535	459	107683889	6152401	105318756
449	Willie Salim	NA	NA	18500000	4051072188	People & Blogs	Willie Salim	679	Indonesia	ID	People	1868	13	25	197369000	49300	789500	592100	9500000	0	2014	Jan	6	363	270203917	469	151509724	-789275	113921327
450	PDK Films	Channel known for its Nerf war videos and action skits.	English	18400000	4120324310	Entertainment	PDK Films	111	United States	US	Entertainment	1825	120	116	14430000	3600	57700	43300	692600	0	2009	Jul	21	882	328239523	147	270663028	3709024	-95712891
451	TheWillyrex	"Spanish YouTuber focused on gaming, particularly ""Minecraft"" and ""Fortnite."""	Spanish	18400000	7038827526	Comedy	TheWillyrex	6943	Spain	ES	Games	825	7	33	11004000	2800	44000	33000	528200	0	2011	Jan	26	889	47076781	1396	37927409	40463667	-374922
452	RsiamMusic :	Thai music label known for producing and sharing music videos of Thai artists.	Thai	18400000	11544297793	Music	RsiamMusic :	3159	Thailand	TH	Music	346	6	103	54133000	13500	216500	162400	2600000	0	2011	Mar	8	493	69625582	75	35294600	15870032	100992541
453	Dhar Mann	Creates motivational and inspirational content in the form of short films.	English	18400000	11280732382	People & Blogs	Alejandro Basalo	0	United States	US		4057944				0	0	0	0	0	2007	Apr	25	882	328239523	147	270663028	3709024	-95712891
454	shakiraVEVO	Official VEVO channel for the artist Shakira, featuring her music videos.	English	18400000	25367126292	Music	shakiraVEVO	197	United States	US	Music	72	120	103	267126000	66800	1100000	801400	12800000	0	2009	Sep	2	882	328239523	147	270663028	3709024	-95712891
455	Naisa Alifia Yuriza (N.A.Y)	Indonesian YouTuber known for her vlogs and challenge videos.	Indonesian	18300000	1606834186	People & Blogs	Naisa Alifia Yuriza (N.A.Y)	786	Indonesia	ID	Entertainment	6502	14	117	17063000	4300	68300	51200	819000	0	2017	Jul	8	363	270203917	469	151509724	-789275	113921327
456	Miley Cyrus	Official channel of the artist Miley Cyrus, featuring her music and video content.	English	18300000	7760819588	Entertainment	Miley Cyrus	142	United States	US	Entertainment	696	121	117	127982000	32000	511900	383900	6100000	0	2009	Sep	15	882	328239523	147	270663028	3709024	-95712891
457	IShowSpeed	Rapidly growing gaming and entertainment channel with live streams and energetic commentary.	English	18300000	1556003039	Gaming	IShowSpeed	1324	United States	US	Games	6734	120	33	140261000	35100	561000	420800	6700000	0	2016	Mar	21	882	328239523	147	270663028	3709024	-95712891
458	Good Mythical Morning	Hosts Rhett & Link provide comedic talk-show-style content with a variety of games and taste tests.	English	18300000	8798044678	Entertainment	Goodmythicalmorning	0	United States	US		3612215	3305			0	0	0	0	0				882	328239523	147	270663028	3709024	-95712891
459	Bobby chourasiya	NA	NA	18200000	9937823152	People & Blogs	Bobby chourasiya	442	India	IN	People	452		27	467848000	117000	1900000	1400000	22500000	0	2019	Jan	25	281	1366417754	536	471031528	20593684	7896288
460	INCR	"Portuguese channel likely providing ""incredible"" facts, stories, or entertainment."	Portuguese	18200000	3213324455	People & Blogs	INCR??	6903	Brazil	BR	Howto	2610	25	15	18045000	4500	72200	54100	866200	0	2017	Jun	20	513	212559417	1208	183241641	-14235004	-5192528
461	Jake Fellman	NA	NA	18100000	13378360425	Entertainment	Jake Fellman	420	United States	US	Entertainment	274	122	118	497044000	124300	2000000	1500000	23900000	0	2012	Oct	13	882	328239523	147	270663028	3709024	-95712891
462	GEN HALILINTAR	An Indonesian family of YouTubers known for their travel vlogs and music videos.	Indonesian	18100000	3306242674	Entertainment	GEN HALILINTAR	1037	Indonesia	ID	Entertainment	2498	15	119	27312000	6800	109200	81900	1300000	0	2015	Mar	4	363	270203917	469	151509724	-789275	113921327
463	SQUEEZIE	French YouTuber known for his Let's Play commentaries and vlogs.	French	18100000	9983065083	Gaming	SQUEEZIE	1521	France	FR	Entertainment	443	1	119	48099000	12000	192400	144300	2300000	0	2011	Jan	9	656	67059887	843	54123364	46227638	2213749
464	Blippi - Educational Videos for Kids	Channel creates educational videos for young children, featuring the character Blippi.	English	18100000	14857290259	Education	Blippi - Educational Videos for Kids	707	United States	US	Education	224	123	26	180412000	45100	721600	541200	8700000	0	2014	Jan	27	882	328239523	147	270663028	3709024	-95712891
465	officialpsy	"Official channel for PSY, the South Korean singer of ""Gangnam Style"" fame."	Korean	18100000	10703830496	Music	officialpsy	131	South Korea	KR	Music	393	10	104	64989000	16200	260000	195000	3100000	0	2010	Oct	4	943	51709098	415	42106719	35907757	127766922
466	Ajay Sharma	NA	NA	18100000	12249828886	Entertainment	Ajay Sharma	0	India	IN		4057944				0	0	0	0	0	2009	Oct	24	281	1366417754	536	471031528	20593684	7896288
467	Manual do Mundo	Brazilian channel that provides educational content with experiments, challenges, and DIYs.	Portuguese	18000000	3980991248	Howto & Style	Manual do Mundo	2470	Brazil	BR	Tech	1922	26	8	54766000	13700	219100	164300	2600000	0	2006	Jul	24	513	212559417	1208	183241641	-14235004	-5192528
468	How Ridiculous	Channel featuring a group of Australians performing trick shots and stunts.	English	18000000	9601137077	Sports	How Ridiculous	650	Australia	AU	Sports	478	5	6	391298000	97800	1600000	1200000	18800000	0	2009	Sep	9	1131	25766605	527	21844756	-25274398	133775136
469	And TV	Hindi language channel offering a range of TV dramas and serials.	Hindi	18000000	15412333005	Entertainment	ANDtv	45	United States	US	Entertainment	4012108	7627	6667	4	0	2	1	19	0	2006	Aug	4	882	328239523	147	270663028	3709024	-95712891
470	Sebasti	NA	NA	18000000	10463166404	News & Politics	Sebasti	237	United States	US	Music	406	124	105	110776000	27700	443100	332300	5300000	0	2013	Mar	30	882	328239523	147	270663028	3709024	-95712891
471	SonyMusicSouthVEVO	Official VEVO for Sony Music South, showcasing music from the South Indian film industry.	Tamil	18000000	17921124985	Music	SonyMusicSouthVEVO	5692	United States	US	Music	148	123	104	257597000	64400	1000000	772800	12400000	0	2014	Jul	14	882	328239523	147	270663028	3709024	-95712891
472	TheGrefg	"Spanish gaming YouTuber known for his ""Fortnite"" streams and gameplay."	Spanish	18000000	6404852037	Gaming	TheGrefg	3566	Spain	ES	Games	950	8	34	43830000	11000	175300	131500	2100000	0	2012	Jan	30	889	47076781	1396	37927409	40463667	-374922
473	BeatboxJCOP	NA	NA	18000000	8716982055	Film & Animation	BeatboxJCOP	748	South Korea	KR	Entertainment	539		115	1375000000	343800	5500000	4100000	66000000	0	2011	Mar	12	943	51709098	415	42106719	35907757	127766922
474	David Dobrik	Influential YouTuber known for his high-energy vlogs and elaborate stunts with his group of friends.	English	17900000	7176572299	People & Blogs	David Dobrik	536	United States	US	People	801	125	28	8650000	2200	34600	26000	415200	0	2014	Dec	19	882	328239523	147	270663028	3709024	-95712891
475	KatieAngel	Venezuelan YouTuber who posts a variety of content, including music, vlogs, and beauty.	Spanish	17900000	3841205465	People & Blogs	KatieAngel	982	United States	US	Music	2014	125	106	51687000	12900	206700	155100	2500000	0	2015	May	19	882	328239523	147	270663028	3709024	-95712891
476	RobleisIUTU	Argentinian YouTuber with content that includes gaming, vlogs, and challenges.	Spanish	17900000	5168721499	Entertainment	RobleisIUTU	1344	Argentina	AR	Games	1294	9	35	27545000	6900	110200	82600	1300000	0	2013	Apr	15	900	44938712	979	41339571	-38416097	-63616672
477	Lele Pons	Internet personality Lele Pons shares comedic sketches and music videos.	English	17900000	5244917119	Comedy	Lele Pons	185	United States	US	Entertainment	1264	125	121	18548000	4600	74200	55600	890300	0	2015	Sep	19	882	328239523	147	270663028	3709024	-95712891
478	Demi Lovato	Official channel for singer and actress Demi Lovato, featuring her music content.	English	17900000	6888074944	Music	Demi Lovato	314	United States	US	Music	858	125	106	29182000	7300	116700	87500	1400000	0	2008	Jan	30	882	328239523	147	270663028	3709024	-95712891
479	Like Nastya VNM	"Vietnamese version of the ""Like Nastya"" channel, which features family-friendly vlogs and adventures."	Vietnamese	17900000	9867515979	Entertainment	Like Nastya VNM	602	Vietnam	VN	Entertainment	455	1	121	84467000	21100	337900	253400	4100000	0	2019	Nov	22	285	96462106	201	35332140	14058324	108277199
480	Jason Derulo	Official channel of the artist Jason Derulo, known for his music videos and dance content.	English	17900000	9887116267	Music	Jason Derulo	830	United States	US	Music	446	124	105	447891000	112000	1800000	1300000	21500000	0	2008	Jul	21	882	328239523	147	270663028	3709024	-95712891
481	MGC Playhouse	NA	NA	17900000	16174530046	Shows	MGC Playhouse	1426	United States	US	Education	187	125	27	102621000	25700	410500	307900	4900000	0	2009	Feb	3	882	328239523	147	270663028	3709024	-95712891
482	Zuni and Family	NA	NA	17900000	6746269458	People & Blogs	zuni and family	2	Indonesia	ID	People	4057766		7733	4	0	2	1	19	0	2020	Jul	15	363	270203917	469	151509724	-789275	113921327
483	Priyal Kukreja	NA	NA	17800000	11057945183	People & Blogs	Priyal Kukreja	772	India	IN	People	378	83	29	431390000	107800	1700000	1300000	20700000	0	2021	Apr	23	281	1366417754	536	471031528	20593684	7896288
484	MSA previously My Story Animated	Channel that animates and shares stories submitted by viewers.	English	17800000	8588704539	Film & Animation	MSA Previously My Story Animated	26	United States	US	People	3976090	5208	4978	20708	5	83	62	994	0	2021	Nov	9	882	328239523	147	270663028	3709024	-95712891
485	KIMPRO	NA	NA	17700000	19206701832	People	????????? KIMPRO	1646	South Korea	KR	People	125	9	26	3404000000	850900	13600000	10200000	163400000	0	2017	Nov	11	943	51709098	415	42106719	35907757	127766922
486	Jane ASMR	ASMR content creator known for her eating sounds and whispering for relaxation.	Korean	17700000	7387621644	People	Jane ASMR	1888	South Korea	KR	People	762	11	30	102803000	0	0	0	0	0	2012	Nov	17	943	51709098	415	42106719	35907757	127766922
487	ArianaGrandeVevo	Official VEVO channel for Ariana Grande, featuring her music videos.	English	17700000	20115544708	Music	ArianaGrandeVevo	178	United States	US	Music	122	127	108	97422000	24400	389700	292300	4700000	0	2010	Oct	21	882	328239523	147	270663028	3709024	-95712891
488	jaanvi patel	NA	NA	17700000	7912733203	People & Blogs	jaanvi patel	512	India	IN	People	671	84	30	346753000	86700	1400000	1000000	16600000	0	2018	Jul	18	281	1366417754	536	471031528	20593684	7896288
489	tanboy kun	Indonesian YouTuber known for culinary content and cooking vlogs.	Indonesian	17700000	3647267655	People & Blogs	tanboy kun	739	Indonesia	ID	Entertainment	2169	17	122	48174000	12000	192700	144500	2300000	0	2016	Oct	27	363	270203917	469	151509724	-789275	113921327
490	Lil Pump	Official channel of rapper Lil Pump, offering music videos and lifestyle content.	English	17700000	4196061192	Music	Lil Pump	60	United States	US	Music	1785		108	9243000	0	0	0	0	0	2015	Oct	15	882	328239523	147	270663028	3709024	-95712891
491	Porta dos Fundos	Brazilian comedy channel with skits and parodies.	Portuguese	17700000	7739048000	Entertainment	Porta dos Fundos	2240	Brazil	BR	Entertainment	705	27	123	35337000	8800	141300	106000	1700000	0	2012	Mar	12	513	212559417	1208	183241641	-14235004	-5192528
492	News 24	NA	NA	17700000	8396875537	News & Politics	24 ????	211620	Ukraine	UA	News	880	24	112	370779000	92700	1500000	1100000	17800000	0	2006	Feb	5	827	44385155	888	30835699	48379433	3116558
493	Les' Copaque Production	"Malaysian animation studio known for the ""Upin & Ipin"" animated series."	Malay	17700000	9059696049	Film & Animation	Les' Copaque Production	1716	Malaysia	MY	Entertainment	531	1	123	117727000	29400	470900	353200	5700000	0	2009	Nov	9	451	32447385	332	24475766	4210484	101975766
494	El Payaso Plim Plim	Channel offers children's content featuring the character Plim Plim.	Spanish	17700000	17247584185	Film & Animation	El Payaso Plim Plim	1316	Argentina	AR	Music	162	10	107	640030000	160000	2600000	1900000	30700000	0	2013	Oct	18	900	44938712	979	41339571	-38416097	-63616672
495	zbing z.	Thai YouTuber known for gaming content and playful vlogs.	Thai	17600000	9269174070	Gaming	zbing z.	3151	Thailand	TH	Games	511	7	36	55127000	13800	220500	165400	2600000	0	2014	Mar	12	493	69625582	75	35294600	15870032	100992541
496	MissaSinfonia	Mexican YouTuber who combines humor with music and animated content.	Spanish	17600000	2274007523	Comedy	MissaSinfonia	233	Mexico	MX	Comedy	4139	17	25	27445000	6900	109800	82300	1300000	0	2011	Jan	5	402	126014024	342	102626859	23634501	-102552784
497	Liziqi	Chinese YouTuber known for her videos on traditional Chinese food and country living.	Chinese	17600000	2977741577	Howto & Style	Liziqi	128	China	CN	Howto	2917	1	16	22354000	5600	89400	67100	1100000	0	2017	Aug	22	506	1397715000	432	842933962	3586166	104195397
498	The Game Theorists	Channel that explores the lore and science behind popular video games.	English	17600000	3752347262	Gaming	TheGameTheorists	0	Australia	AU		3612215	6095			0	0	0	0	0				1131	25766605	527	21844756	-25274398	133775136
499	DeGoBooM	Spanish-language gaming channel, likely with a focus on fun and interactive content.	Spanish	17600000	6306204566	Gaming	DeGoBooM	4702	Chile	CL	Games	973	3	36	100215000	25100	400900	300600	4800000	0	2014	Feb	1	885	18952038	709	16610135	-35675147	-71542969
500	JFlaMusic	Korean singer known for her vocal covers of popular songs on YouTube.	Korean	17600000	3802280098	Music	JFlaMusic	326	South Korea	KR	Music	2056	12	109	11099000	2800	44400	33300	532700	0	2011	Aug	22	943	51709098	415	42106719	35907757	127766922
501	FactTechz	Channel providing interesting facts and educational content.	Hindi	17500000	2238134438	Entertainment	FactTechz	709	India	IN	Entertainment	4243	86	124	21056000	5300	84200	63200	1000000	0	2016	Jul	24	281	1366417754	536	471031528	20593684	7896288
502	News18 India	News channel delivering the latest updates and news in India.	Hindi	17500000	7263619576	News & Politics	News18 India	182742	India	IN	News	770	85	10	394106000	98500	1600000	1200000	18900000	0	2007	Oct	25	281	1366417754	536	471031528	20593684	7896288
503	Fun For Kids TV - Hindi Rhymes	Channel offering animated Hindi nursery rhymes and children's songs.	Hindi	17500000	7612385622	Entertainment	Fun For Kids TV - Hindi Rhymes	149	India	IN	Entertainment	723	86	124	109847000	27500	439400	329500	5300000	0	2017	Sep	27	281	1366417754	536	471031528	20593684	7896288
504	IGN	Leading media outlet for video game and entertainment news, reviews, and guides.	English	17500000	16107116549	Gaming	IGN	156215	United States	US	Games	189	129	37	98342000	24600	393400	295000	4700000	0	2006	Sep	19	882	328239523	147	270663028	3709024	-95712891
505	Aphmau	Gamer known for Minecraft roleplays and various gaming content.	English	17400000	17763586483	Gaming	Aphmau	4411	United States	US	Games	152	129	37	439870000	110000	1800000	1300000	21100000	0	2012	Aug	13	882	328239523	147	270663028	3709024	-95712891
506	AMARINTV	Thai TV station providing news, entertainment, and original content.	Thai	17400000	13043561912	Entertainment	AMARINTV	118448	Thailand	TH	News	286	8	11	235993000	59000	944000	708000	11300000	0	2014	Feb	5	493	69625582	75	35294600	15870032	100992541
507	Al-Remas	Possibly a channel related to Arabic music or entertainment.	Arabic	17400000	11144195464	Music	Al-Remas	2133	Iraq	IQ	Music	371	1	110	113003000	28300	452000	339000	5400000	0	2013	Sep	27	162	39309783	1282	27783368	33223191	43679291
508	Koray Zeynep	NA	NA	17400000	16560557488	People & Blogs	Koray Zeynep	2078	Turkey	TR	People	173		31	426389000	106600	1700000	1300000	20500000	0	2016	Jul	8	239	83429615	1349	63097818	38963745	35243322
509	Apple	Official channel of Apple Inc. featuring product announcements and advertisements.	English	17300000	1026425106	Science & Technology	Apple	180	United States	US	Tech	11274	130	9	46484000	11600	185900	139500	2200000	0	2005	Jun	22	882	328239523	147	270663028	3709024	-95712891
510	Stubborn Facts	NA	NA	17300000	902225615	Film & Animation	Stubborn Facts	287	India	IN	Entertainment	13315	87	125	837850	209	3400	2500	40200	0	2016	Sep	5	281	1366417754	536	471031528	20593684	7896288
511	Taarak Mehta Ka Ooltah Chashmah	Channel related to the popular Indian sitcom of the same name.	Hindi	17300000	11371738047	Entertainment	Taarak Mehta Ka Ooltah Chashmah	4778	India	IN	Entertainment	356	87	125	331944000	83000	1300000	995800	15900000	0	2014	Aug	4	281	1366417754	536	471031528	20593684	7896288
512	HowToBasic	"Channel known for absurd and comedic ""how-to"" tutorials."	English	17300000	3684816159	Howto & Style	HowToBasic	582	Australia	AU	Howto	2146	6	17	15525000	3900	62100	46600	745200	0	2011	Dec	8	1131	25766605	527	21844756	-25274398	133775136
513	PopularMMOs	Gaming channel with a focus on Minecraft, challenges, and mod reviews.	English	17200000	14573155899	Gaming	PopularMMOs	4685	United States	US	Games	240		38	15296000	3800	61200	45900	734200	0	2012	Apr	17	882	328239523	147	270663028	3709024	-95712891
514	Marques Brownlee	Tech reviewer known for in-depth analyses and reviews of consumer electronics.	English	17200000	3606912471	Science & Technology	Marques Brownlee	1567	United States	US	Tech	2196	131	10	52325000	13100	209300	157000	2500000	0	2008	Mar	21	882	328239523	147	270663028	3709024	-95712891
515	Anitta	Official channel of Brazilian singer Anitta, featuring her music and videos.	Portuguese	17200000	7337212581	Music	Anitta	138	Brazil	BR	Music	769	28	111	72684000	18200	290700	218100	3500000	0	2011	Nov	2	513	212559417	1208	183241641	-14235004	-5192528
516	Jason Vlogs	Channel documenting the life of a young boy named Jason and his daily activities.	English	17200000	8903647480	Education	Jason Oo	83	Australia	AU	People	4031958	3450	7408	25	1	1	8	1	0	2014	Sep	11	1131	25766605	527	21844756	-25274398	133775136
517	El Reino a Jugar	Spanish children's channel with songs and educational content.	Spanish	17200000	11445492404	Education	El Reino a Jugar	1007	Argentina	AR	Education	353	11	28	83709000	20900	334800	251100	4000000	0	2015	Mar	3	900	44938712	979	41339571	-38416097	-63616672
518	Willyrex	Spanish gamer and YouTuber focused on various video games.	Spanish	17200000	5024088947	Gaming	Willyrex	7550	Spain	ES	Games	1359	9	38	15405000	3900	61600	46200	739500	0	2009	Aug	9	889	47076781	1396	37927409	40463667	-374922
519	TheBrianMaps	Russian YouTuber known for vlogs, challenges, and comedic content.	Russian	17100000	4448334716	Comedy	TheBrianMaps	498	Russia	RU	Entertainment	1624	6	126	37164000	9300	148700	111500	1800000	0	2012	Jun	4	819	144373535	459	107683889	6152401	105318756
520	TRANS TV Official	Indonesian TV channel offering a variety of shows and entertainment.	Indonesian	17100000	9710962528	Entertainment	TRANS TV Official	148225	Indonesia	ID	Entertainment	472	18	127	45811000	11500	183200	137400	2200000	0	2014	Sep	2	363	270203917	469	151509724	-789275	113921327
521	Liza Koshy	Internet personality known for her comedic videos and challenges.	English	17100000	2173106162	Comedy	Liza Koshy	142	United States	US	Entertainment	4443	132	127	1761000	440	7000	5300	84500	0	2013	Sep	2	882	328239523	147	270663028	3709024	-95712891
522	Queen Official	Official channel for the British rock band Queen.	English	17000000	10847948832	Music	Queen Official	1015	United Kingdom	GB	Music	385	21	112	93768000	23400	375100	281300	4500000	0	2008	Jul	7	600	66834405	385	55908316	55378051	-3435973
523	Prajapati News	NA	NA	17000000	1001465469	Comedy	Prajapati News	1407	India	IN	Entertainment	11662	89	128	7626000	1900	30500	22900	366100	0	2013	Mar	14	281	1366417754	536	471031528	20593684	7896288
524	Gaby and Alex	Channel featuring two siblings engaging in play and educational activities.	English	17000000	8229883114	Entertainment	gabyandalex	1	United States	US	People	4057752		7732		0	0	0	0	0	2008	Aug	21	882	328239523	147	270663028	3709024	-95712891
525	LuisFonsiVEVO	"VEVO channel for Puerto Rican singer Luis Fonsi, known for ""Despacito."""	Spanish	17000000	14543594822	Music	LuisFonsiVEVO	97	United States	US	Music	241	133	112	49817000	12500	199300	149500	2400000	0	2009	May	12	882	328239523	147	270663028	3709024	-95712891
526	Pop Chartbusters	Channel offering a mix of music videos and Indian pop content.	Hindi	16900000	8684010451	Music	Pop Chartbusters	2235	India	IN	Music	574	90	113	72911000	18200	291600	218700	3500000	0	2011	Aug	26	281	1366417754	536	471031528	20593684	7896288
527	Guava Juice	YouTuber known for his challenge videos, DIYs, and experiments.	English	16900000	9111000228	Gaming	Guava Juice	1910	United States	US	Entertainment	527	134	129	10889000	2700	43600	32700	522600	0	2006	Jul	18	882	328239523	147	270663028	3709024	-95712891
528	EeOneGuy	Entertainer and gamer providing content in Russian.	Russian	16900000	3827906874	Entertainment	EeOneGuy	366	United States	US	Entertainment	2039	134	129	1635000	409	6500	4900	78500	0	2013	Mar	19	882	328239523	147	270663028	3709024	-95712891
529	VICE	Channel for the global youth media company focusing on investigative journalism and documentary.	English	16900000	4609753237	Entertainment	VICE	3900	United States	US	Entertainment	1543	134	129	36357000	9100	145400	109100	1700000	0	2005	Dec	16	882	328239523	147	270663028	3709024	-95712891
530	Aayu and Pihu Show	Indian kids' channel featuring challenges, skits, and family-friendly entertainment.	Hindi	16900000	9270331567	Comedy	Aayu and Pihu Show	441	India	IN	People	510	90	34	89782000	22400	359100	269300	4300000	0	2017	May	8	281	1366417754	536	471031528	20593684	7896288
531	Danny Fitt	NA	NA	16900000	9544277833	People & Blogs	Danny Fitt	2337	United States	US	Entertainment	488	134	129	275264000	68800	1100000	825800	13200000	0	2016	Dec	31	882	328239523	147	270663028	3709024	-95712891
532	Bispo Bruno Leonardo	NA	NA	16900000	3523578665	Nonprofits & Activism	Bispo Bruno Leonardo	4891	Brazil	BR	Nonprofit	2307	29	2	149543000	37400	598200	448600	7200000	0	2016	Apr	10	513	212559417	1208	183241641	-14235004	-5192528
533	DeToxoMoroxo	Channel featuring lists, curiosities, and interesting facts, likely in Spanish.	Spanish	16800000	2315962318	Entertainment	de toxomoroxo	1	Mexico	MX	Music	4056488		5767		0	0	0	0	0	2016	Apr	30	402	126014024	342	102626859	23634501	-102552784
534	Doggy Doggy Cartoons	Children's channel with animated cartoons.	English	16800000	6518418501	Entertainment	Doggy Doggy Cartoons	0	Spain	ES		4057944				0	0	0	0	0	2018	Nov	11	889	47076781	1396	37927409	40463667	-374922
535	deepesh zo	NA	NA	16800000	7206462713	People & Blogs	deepesh zo	41	India	IN	People	4038822		7611	1	0	0	0	5	0	2021	Sep	24	281	1366417754	536	471031528	20593684	7896288
536	Like Nastya IDN	Indonesian version of Like Nastya, featuring a child influencer's family-friendly vlogs.	Indonesian	16800000	7195314800	Entertainment	Like Nastya IDN	502	Indonesia	ID	Entertainment	795	19	130	42836000	10700	171300	128500	2100000	0	2019	Nov	22	363	270203917	469	151509724	-789275	113921327
537	Gato Galactico	Brazilian channel featuring animations and family-friendly content.	Portuguese	16800000	3693798804	Film & Animation	Gato Galactico	1491	Brazil	BR	Entertainment	2129	30	130	44121000	11000	176500	132400	2100000	0	2013	Apr	2	513	212559417	1208	183241641	-14235004	-5192528
538	Salman Noman	NA	NA	16700000	10393037902	Entertainment	salman Noman	3	India	IN		4057674			7	0	3	2	34	0	2022	May	14	281	1366417754	536	471031528	20593684	7896288
539	CoryxKenshin	Gamer known for his comedic commentary and playthroughs.	English	16700000	7102965621	Gaming	CoryxKenshin	1693	United States	US	Games	814	135	39	105114000	26300	420500	315300	5000000	0	2009	Apr	27	882	328239523	147	270663028	3709024	-95712891
540	With Kids 	NA	NA	16700000	8826138204	Entertainment	With Kids 	920	United States	US	Entertainment	559	135	130	45698000	11400	182800	137100	2200000	0	2012	Jul	6	882	328239523	147	270663028	3709024	-95712891
541	Travis Scott	Official channel for the American rapper and singer-songwriter.	English	16700000	7979736581	Music	Travis Scott	13	United States	US	Music	564542	1920	1751	37623	9	150	113	1800	0	2010	Sep	1	882	328239523	147	270663028	3709024	-95712891
542	Tu COSMOPOLIS	Channel offering videos on varied topics, likely in Spanish.	Spanish	16700000	5089284369	People & Blogs	Tu COSMOPOLIS	8741	Mexico	MX	People	1337	19	35	16139000	4000	64600	48400	774700	0	2014	Aug	28	402	126014024	342	102626859	23634501	-102552784
543	Ivana Alawi	Filipina actress and YouTuber sharing vlogs and personal life content.	Tagalog	16600000	1318442641	People	Ivana Alawi	180	Philippines	PH	People	8338	5	36	15079000	3800	60300	45200	723800	0	2018	Jun	1	355	108116615	215	50975903	12879721	121774017
544	Werever2morro	Mexican YouTuber creating comedic content and vlogs.	Spanish	16600000	2798273962	Entertainment	werever2morro	0	Mexico	MX	Games	4057944	4248	7462		0	0	0	0	0	2010	Dec	7	402	126014024	342	102626859	23634501	-102552784
545	IDEAS EN 5 MINUTOS	Spanish-language channel with a variety of life hacks and DIYs.	Spanish	16600000	3696973456	Howto & Style	Ideas En 5 Minutos	216	Spain	ES	Howto	3108857	2753		65470	16	262	196	3100	0	2017	Apr	2	889	47076781	1396	37927409	40463667	-374922
