169	Enaldinho	Brazilian YouTuber producing content ranging from challenges to comedic skits.	Portuguese	29200000	11627437847	Comedy	Enaldinho	3654	Brazil	BR	Games	338	10	15	303100000	75800	1200000	909300	14500000	0	2012	Nov	7	513	212559417	1208	183241641	-14235004	-5192528
170	AuronPlay	Spanish YouTuber and streamer known for his gaming content and social commentary.	Spanish	29200000	4079141673	Comedy	AuronPlay	404	Spain	ES	Comedy	1852	3	9	12143000	3000	48600	36400	582900	0	2006	Feb	28	889	47076781	1396	37927409	40463667	-374922
171	Shorts Break	NA	NA	29000000	19466238065	Comedy	shorts break	42	India	IN		3997024			60805	15	243	182	2900	0	2021	Jan	28	281	1366417754	536	471031528	20593684	7896288
172	infobells - Tamil	Educational content and children's songs in Tamil.	Tamil	28900000	17930570614	Education	infobells - Tamil	555	India	IN	Education	149	44	13	109828000	27500	439300	329500	5300000	0	2014	Mar	13	281	1366417754	536	471031528	20593684	7896288
173	Aditya Music India	Music channel with a vast collection of Indian music videos, soundtracks, and hits.	Hindi	28500000	25857994495	Music	Aditya Music	0	India	IN	Music	4057944	0	4721		0	0	0	0	0	2010	Dec	16	281	1366417754	536	471031528	20593684	7896288
174	The Late Late Show with James Corden	Official channel for the late-night talk show featuring celebrity interviews, games, and Carpool Karaoke.	English	28400000	9956764048	Entertainment	The Late Late Show with James Corden	5809	United States	US	Entertainment	445	53	49	26435000	6600	105700	79300	1300000	0	2006	Nov	21	882	328239523	147	270663028	3709024	-95712891
175	Aditya Movies	Offers a wide range of Telugu movies, shows, and exclusive content.	Telugu	28400000	10062770060	Movies	Aditya Movies	5436	India	IN	Film	432	45	11	227355000	56800	909400	682100	10900000	0	2012	Feb	23	281	1366417754	536	471031528	20593684	7896288
176	Masha y el Oso	"Spanish-dubbed content from the popular Russian children's show ""Masha and the Bear."""	Spanish	28300000	13577142726	Film & Animation	Masha y El oso	6	Russia	RU		4057907	0	0	2	0	1	1	1	0	2019	Jul	21	819	144373535	459	107683889	6152401	105318756
177	infobells - Telugu	Children's educational songs and stories in Telugu.	Telugu	28300000	14814192034	Education	infobells - Telugu	505	India	IN	Education	223	45	14	288110000	72000	1200000	864300	13800000	0	2014	Mar	13	281	1366417754	536	471031528	20593684	7896288
178	HUM TV	Pakistani drama channel offering a variety of TV series and shows.	Urdu	28300000	23844936965	Entertainment	HUM TV	106983	Pakistan	PK	Entertainment	80	3	49	684860000	171200	2700000	2100000	32900000	0	2011	May	25	90	216565318	445	79927762	30375321	69345116
179	Shemaroo Movies	Provides a wide selection of Indian cinema, from classic films to recent hits.	Hindi	28200000	7600740993	Entertainment	Shemaroo Movies	3009	India	IN	Film	721	46	13	184966000	46200	739900	554900	8900000	0	2011	Mar	1	281	1366417754	536	471031528	20593684	7896288
180	Michael Jackson	Official channel commemorating the King of Pop, Michael Jackson, with music videos and performances.	English	28200000	14412474625	Music	Michael Jackson	15	United States	US	Music	242	54	59	158591000	39600	634400	475800	7600000	0	2005	Jun	22	882	328239523	147	270663028	3709024	-95712891
181	Drake	Official channel for the Grammy-winning artist Drake, featuring music and videos.	English	28100000	15318895118	Music	drake	3	Canada	CA	Film	4011030		4909	31	1	12	9	1	0	2005	Sep	23	689	36991981	556	30628482	56130366	-106346771
182	Goldmines Dishoom	Specializes in Bollywood action movies and dubbed South Indian films.	Hindi	28000000	8603468420	Film & Animation	Goldmines Dishoom	3878	India	IN	Film	587		14	129211000	32300	516800	387600	6200000	0	2016	Nov	26	281	1366417754	536	471031528	20593684	7896288
183	Sandeep Maheshwari	Motivational speaker and entrepreneur sharing inspirational content and seminars.	Hindi	27800000	2303069221	People & Blogs	Sandeepmaheshwari	0	Singapore	SG		4057944	3017			0	0	0	0	0	2008	Jan	2	848	5703569	411	5703569	1352083	103819836
184	Bounce Patrol - Kids Songs	Engaging kids with colorful and animated songs and learning experiences.	English	27800000	21037851468	Music	Bounce Patrol - Kids Songs	292	Australia	AU	Music	111	1	61	127441000	31900	509800	382300	6100000	0	2013	Jan	1	1131	25766605	527	21844756	-25274398	133775136
185	toycantando	Spanish language children's channel with songs, stories, and educational content.	Spanish	27700000	15777682516	Music	toycantando	619	Colombia	CO	Music	197	4	62	173836000	43500	695300	521500	8300000	0	2009	Jul	7	553	50339443	971	40827302	4570868	-74297333
186	MrBeast 2	Secondary channel for MrBeast, potentially featuring extra content or outtakes.	English	27500000	4552581106	People & Blogs	Leaux Pass	27	United States	US	Music	2161873	5889	4311	649	0	0	0	0	0	2011	Jun	23	882	328239523	147	270663028	3709024	-95712891
187	Wiz Khalifa	The official channel of the American rapper, featuring music videos and behind-the-scenes content.	English	27500000	13379395501	Music	Wiz Khalifa	682	United States	US	Music	275	57	63	90450000	22600	361800	271300	4300000	0	2008	May	9	882	328239523	147	270663028	3709024	-95712891
188	JYP Entertainment	Official channel of the South Korean music label, showcasing their K-pop artists and groups.	Korean	27400000	19883150017	Music	JYP Entertainment	1753	South Korea	KR	Music	124	4	64	307631000	76900	1200000	922900	14800000	0	2008	Jan	25	943	51709098	415	42106719	35907757	127766922
189	Kids Roma Show	A children's entertainment channel featuring play activities, toys, and fun family outings.	Russian	27400000	10336420490	People & Blogs	Kids Roma Show	642	United States	US	Entertainment	418	58	50	175844000	44000	703400	527500	8400000	0	2015	May	12	882	328239523	147	270663028	3709024	-95712891
190	DanTDM	British YouTuber known for his Minecraft gaming series, reviews, and vlogs.	English	27400000	19417887510	Gaming	DanTDM	3664	United Kingdom	GB	Games	132	7	16	78668000	19700	314700	236000	3800000	0	2012	Jul	14	600	66834405	385	55908316	55378051	-3435973
191	Nick Jr.	The official channel for the children's television network, offering show clips and educational content.	English	27300000	22440611155	Film & Animation	Nick Jr.	5438	United States	US	Entertainment	100	59	51	42546000	10600	170200	127600	2000000	0	2012	Sep	27	882	328239523	147	270663028	3709024	-95712891
192	Crazy XYZ	An Indian YouTube channel that experiments with creative ideas and life hacks.	Hindi	27300000	7705492350	Entertainment	Crazy XYZ	1259	India	IN	Tech	707	48	2	102235000	25600	408900	306700	4900000	0	2017	Sep	10	281	1366417754	536	471031528	20593684	7896288
193	ToyPuddingTV	Kids' channel with toy unboxings, play activities, and children's stories.	Korean	27100000	15916882228	Entertainment	ToyPudding TV	2	South Korea	KR	People	4052296		7692	14	0	6	4	67	0	2017	Jun	7	943	51709098	415	42106719	35907757	127766922
194	Dushyant kukreja	NA	NA	27100000	17318452893	Entertainment	Dushyant kukreja	889	India	IN	Entertainment	159	49	52	429692000	107400	1700000	1300000	20600000	0	2015	Sep	26	281	1366417754	536	471031528	20593684	7896288
195	Gulshan Kalra	NA	NA	27100000	12732444881	Howto & Style	Gulshan Kalra	545	India	IN	Howto	296		5	502779000	125700	2000000	1500000	24100000	0	2018	Apr	9	281	1366417754	536	471031528	20593684	7896288
196	Brent Rivera	American YouTuber and actor known for his comedic skits and relatable teen content.	English	27000000	6570935979	Comedy	Brent Rivera	554	United States	US	Entertainment	909	60	53	144453000	36100	577800	433400	6900000	0	2009	Aug	1	882	328239523	147	270663028	3709024	-95712891
197	Renato Garcia YT	Brazilian YouTuber sharing vlogs, gaming content, and adventures.	Portuguese	26900000	7938616641	Entertainment	Renato Garcia YT	3956	Brazil	BR	Entertainment	664	11	54	82912000	20700	331600	248700	4000000	0	2011	Sep	29	513	212559417	1208	183241641	-14235004	-5192528
198	Beast Reacts	A reaction channel, possibly related to MrBeast, with commentary on various topics.	English	26700000	4388047013	People & Blogs	Beast Reacts	241	United States	US	Entertainment	1632	61	54	276187000	69000	1100000	828600	13300000	0	2016	Apr	24	882	328239523	147	270663028	3709024	-95712891
199	enchufetv	A comedy channel from Ecuador with sketches parodying everyday life and pop culture.	Spanish	26700000	10317306313	Comedy	enchufetv	975	Colombia	CO	Comedy	420	5	11	24363000	6100	97500	73100	1200000	0	2011	Nov	13	553	50339443	971	40827302	4570868	-74297333
200	Netflix	The official Netflix channel with trailers, clips, and featurettes from their original shows and movies.	English	26700000	7173668905	Entertainment	Netflix	6471	United States	US	Entertainment	797	62	55	118226000	29600	472900	354700	5700000	0	2012	Jul	17	882	328239523	147	270663028	3709024	-95712891
201	Raffy Tulfo in Action	Philippines' premier investigative journalism channel led by Raffy Tulfo, focusing on social injustices and public service.	Filipino	26500000	15065753455	News & Politics	Raffy Tulfo in Action	10022	Philippines	PH	News	219	3	5	163130000	40800	652500	489400	7800000	0	2016	Apr	20	355	108116615	215	50975903	12879721	121774017
202	WORLDSTARHIPHOP	A hub for entertainment and hip hop, showcasing music videos, artist content, and original series.	English	26500000	20358117330	Music	WORLDSTARHIPHOP	6873	United States	US	Music	117	63	65	89098000	22300	356400	267300	4300000	0	2008	Nov	8	882	328239523	147	270663028	3709024	-95712891
203	Goldmines Bollywood	Offers a collection of Bollywood movies, scenes, and songs, bringing classic and modern Indian cinema to viewers.	Hindi	26400000	8595760553	Film & Animation	Goldmines Bollywood	3622	India	IN	Film	588	50	15	99677000	24900	398700	299000	4800000	0	2015	Jul	22	281	1366417754	536	471031528	20593684	7896288
204	Alan Chikin Chow	Comedy sketches and characters with a quirky twist, often involving hilarious social scenarios and relatable content.	English	26400000	27006526665	Comedy	Alan Chikin Chow	865	United States	US	Comedy	61	63	12	1046000000	261500	4200000	3100000	50200000	0	2020	Feb	3	882	328239523	147	270663028	3709024	-95712891
205	PANDA BOI	Features comedic skits and memes that resonate with a younger demographic, all delivered by a charismatic host.	English	26400000	17211600007	Entertainment	PANDA BOI	967	Italy	IT	Entertainment	158	1	55	1225000000	306400	4900000	3700000	58800000	0	2020	Dec	5	619	60297396	989	42651966	4187194	1256738
206	BB Ki Vines	Bhuvan Bam entertains with his unique brand of comedy that captures the life and stories of urban India.	Hindi	26300000	4749833967	Entertainment	BB Ki Vines	190	India	IN	Entertainment	1462	51	57	17264000	4300	69100	51800	828600	0	2015	Jun	20	281	1366417754	536	471031528	20593684	7896288
207	D Billions	Engages toddlers and young children with vibrant, educational songs and playful learning videos.	NA	26200000	31977463002	Entertainment	D Billions	775	United States	US	Entertainment	33	64	58	487076000	121800	1900000	1500000	23400000	0	2019	Jul	27	882	328239523	147	270663028	3709024	-95712891
208	Junya	Best known for his hilarious and sometimes absurd comedic shorts that have gained a significant following.	Japanese	26200000	16097531087	Entertainment	Junya	5985	Japan	JP	Entertainment	184	2	56	721848000	180500	2900000	2200000	34600000	0	2020	Sep	14	632	126226568	229	115782416	36204824	138252924
209	Smosh	A legendary comedy brand known for their sketches, parodies, and humor on relatable life situations.	English	26100000	10435474336	Comedy	Smosh	1619	United States	US	Comedy	410	65	13	68156000	17000	272600	204500	3300000	0	2005	Nov	19	882	328239523	147	270663028	3709024	-95712891
210	1MILLION Dance Studio	World-famous dance studio's channel featuring choreographies, dance videos, and classes from top-notch instructors.	Korean	26100000	7886440199	Entertainment	1MILLION Dance Studio	0	Saudi Arabia	SA	Music	4057944	3695	5641		0	0	0	0	0	2019	Jul	13	680	34268528	593	28807838	23885942	45079162
211	NichLmao	A channel that delivers humor through short-form content, memes, and trendy internet culture references.	English	26000000	14101010609	People & Blogs	NichLmao	868	Singapore	SG	People	249		6	606362000	151600	2400000	1800000	29100000	0	2018	Sep	25	848	5703569	411	5703569	1352083	103819836
212	Beyonc	The official channel for the global music icon Beyonc, featuring her music videos, live performances, and documentary snippets.	English	26000000	17308961985	Music	Beyonc?	240	United States	US	Music	163	66	66	55454000	13900	221800	166400	2700000	0	2005	Nov	7	882	328239523	147	270663028	3709024	-95712891
213	Mar	A unique mix of vlogs, challenges, and lifestyle content, all presented with a personal and engaging touch.	NA	26000000	18597534412	Music	mariliamendonca	1	Brazil	BR	Music	4057142		4914	3	0	1	1	14	0	2008	Jun	14	513	212559417	1208	183241641	-14235004	-5192528
214	Indosiar	A leading Indonesian TV channel that shares a variety of shows, from dramas to singing competitions and cultural content.	Indonesian	25900000	11372071889	Music	Indosiar	65286	Indonesia	ID	Entertainment	358	5	60	230183000	57500	920700	690500	11000000	0	2013	Sep	23	363	270203917	469	151509724	-789275	113921327
215	VanossGaming	Focused on video games, comedic commentary, and animated parodies for an audience that loves gaming culture.	English	25800000	15541421838	Gaming	VanossGaming	1762	Canada	CA	Games	206	5	17	54947000	13700	219800	164800	2600000	0	2011	Sep	15	689	36991981	556	30628482	56130366	-106346771
216	David Guetta	The world-renowned DJ and producer's channel showcasing his music videos, live DJ sets, and behind-the-scenes footage.	English	25700000	17793809548	Music	David Guetta	749	United States	US	Music	153	67	67	164215000	41100	656900	492600	7900000	0	2009	Dec	11	882	328239523	147	270663028	3709024	-95712891
217	LosPolinesios	Three siblings from Latin America share their life's adventures, challenges, and travel stories.	Spanish	25700000	7466926260	People & Blogs	LosPolinesios	982	Mexico	MX	People	746	8	7	30501000	7600	122000	91500	1500000	0	2012	Dec	16	402	126014024	342	102626859	23634501	-102552784
218	Nicki Minaj	The hip hop queen's official channel, full of her bold music videos, collaborations, and unique style.	English	25700000	10242981063	Music	Nicki Minaj	42	United States	US	Music	425	67	67	103631000	25900	414500	310900	5000000	0	2013	Aug	28	882	328239523	147	270663028	3709024	-95712891
219	Fede Vigevani	High-energy vlogs, pranks, and lifestyle content from a charismatic and engaging content creator.	Spanish	25600000	7962725960	Howto & Style	Fede Vigevani	0	Argentina	AR	Howto	4057944				0	0	0	0	0	2019	Aug	1	900	44938712	979	41339571	-38416097	-63616672
220	TaylorSwiftVEVO	Taylor Swift's VEVO channel, home to her music videos, exclusive clips, and glimpses into her artistic world.	English	25600000	25592378292	Music	TaylorSwiftVEVO	287	United States	US	Music	67	68	68	318593000	79600	1300000	955800	15300000	0	2009	May	12	882	328239523	147	270663028	3709024	-95712891
221	ZHC	An artist who combines creativity with philanthropy, showcasing art challenges, large-scale drawings, and giveaways.	English	25500000	2726917087	Film & Animation	zhc	5	United States	US	Entertainment	4042995		6739	20	1	8	6	96	0	2006	Jan	24	882	328239523	147	270663028	3709024	-95712891
222	Post Malone	Official content from Post Malone, including music videos, performances, and personal snippets from the artist himself.	English	25500000	14401218086	Music	Post Malone	78	United States	US	Music	243	69	69	195499000	48900	782000	586500	9400000	0	2011	Dec	15	882	328239523	147	270663028	3709024	-95712891
223	Rans Entertainment	Indonesian entertainment channel featuring the family life of Raffi Ahmad and Nagita Slavina, along with lifestyle content.	Indonesian	25400000	6430853035	People & Blogs	Rans Entertainment	3716	Indonesia	ID	Entertainment	942	6	62	58487000	14600	233900	175500	2800000	0	2015	Dec	27	363	270203917	469	151509724	-789275	113921327
224	LankyBox	Known for their gaming videos, comedic value, and 'Zero Budget' film parodies, all packed with fun and laughter.	English	25400000	34300482066	Comedy	LankyBox	8775	United States	US	Games	29	69	18	815341000	203800	3300000	2400000	39100000	0	2016	Jul	30	882	328239523	147	270663028	3709024	-95712891
225	Coldplay	Official channel for the band Coldplay, where fans can watch music videos, live performances, and special features.	English	25300000	17331663193	Music	Coldplay	398	United Kingdom	GB	Music	160	8	70	198875000	49700	795500	596600	9500000	0	2010	Jan	3	600	66834405	385	55908316	55378051	-3435973
226	Las Ratitas	Two sisters sharing family-friendly content, playtime videos, and a look into their daily fun activities.	Spanish	25200000	9602246828	People & Blogs	LAS RATITAS	4	Spain	ES	People	4051936		7690	11	0	4	3	53	0	2019	May	31	889	47076781	1396	37927409	40463667	-374922
227	WB Kids	Warner Bros' hub for all animated series and movies, a paradise for young viewers and fans of classic cartoons.	English	25200000	11081602368	People & Blogs	WB Kids	2025	United States	US	Film	375	70	16	140319000	35100	561300	421000	6700000	0	2015	Mar	31	882	328239523	147	270663028	3709024	-95712891
228	ABPLIVE	News channel delivering live updates, breaking stories, and comprehensive coverage from India.	Hindi	25200000	7968363381	People & Blogs	ABPLIVE	12	India	IN	People	4026389		7421	2	0	1	1	1	0	2014	Jul	26	281	1366417754	536	471031528	20593684	7896288
229	Chris Brown	Official channel of the R&B artist Chris Brown, showcasing his music videos, dance moves, and artistic visuals.	English	25200000	15520569496	Music	ChrisBrown	0	United States	US		3612215				0	0	0	0	0				882	328239523	147	270663028	3709024	-95712891
230	The Lallantop	Offers a fresh take on news, current affairs, and complex issues in India with an analytical perspective.	Hindi	25200000	10409352249	News & Politics	The Lallantop	51129	India	IN	News	408	52	6	273920000	68500	1100000	821800	13100000	0	2015	Mar	23	281	1366417754	536	471031528	20593684	7896288
231	RihannaVEVO	Rihanna's VEVO channel, featuring her hit music videos, exclusive performances, and style-defining content.	English	25100000	19458807708	Music	RihannaVEVO	118	United States	US	Music	130	71	72	94246000	23600	377000	282700	4500000	0	2009	May	12	882	328239523	147	270663028	3709024	-95712891
232	WatchMojo.com	Well-known for top 10 lists and countdowns across pop culture, entertainment, music, and history.	English	25100000	16357064198	Music	WatchMojo.com	24837	Canada	CA	Entertainment	180	6	64	49009000	12300	196000	147000	2400000	0	2007	Jan	25	689	36991981	556	30628482	56130366	-106346771
233	TRANS7 OFFICIAL	Indonesian TV channel providing an array of programs from news and documentaries to entertainment and lifestyle.	Indonesian	25000000	14169516119	Entertainment	TRANS7 OFFICIAL	89179	Indonesia	ID	Entertainment	251	7	64	123189000	30800	492800	369600	5900000	0	2014	Sep	4	363	270203917	469	151509724	-789275	113921327
234	Anuel AA	The Puerto Rican rapper and singer's channel is full of his reggaeton and Latin trap hits.	Spanish	25000000	14827085149	Music	Anuel AA	147	Colombia	CO	Music	225	6	73	284144000	71000	1100000	852400	13600000	0	2016	Sep	8	553	50339443	971	40827302	4570868	-74297333
235	Dan Rhodes	Magic and illusions are brought to the screen with a modern twist, engaging audiences in the art of the impossible.	English	24800000	17387583720	Entertainment	Dan Rhodes	1644	United Kingdom	GB	Entertainment	157	9	66	331889000	83000	1300000	995700	15900000	0	2015	Oct	30	600	66834405	385	55908316	55378051	-3435973
236	Yuya	A beloved beauty and lifestyle influencer sharing makeup tutorials, fashion tips, and personal vlogs.	Spanish	24800000	2588501115	Howto & Style	Yuya	672	Mexico	MX	Howto	3505	9	6	336291	84	1300	1000	16100	0	2009	Sep	20	402	126014024	342	102626859	23634501	-102552784
237	America's Got Talent	Official channel for the talent show, featuring memorable auditions, jaw-dropping performances, and inspiring stories.	English	24800000	3699352704	Entertainment	America's Got Talent	1894	United States	US	Entertainment	2122	72	65	134412000	33600	537600	403200	6500000	0	2006	Jun	29	882	328239523	147	270663028	3709024	-95712891
238	mujjuu___14	NA	NA	24800000	14655527943	People & Blogs	mujjuu___14	872	India	IN	People	234		8	400222000	100100	1600000	1200000	19200000	0	2020	May	18	281	1366417754	536	471031528	20593684	7896288
239	EminemVEVO	Official VEVO for Eminem, the rap god, featuring intense music videos and groundbreaking rap tracks.	English	24700000	20531704527	Music	EminemVEVO	104	United States	US	Music	115	73	74	139443000	34900	557800	418300	6700000	0	2009	May	12	882	328239523	147	270663028	3709024	-95712891
240	Chloe Ting	Fitness influencer known for her workout challenges, health tips, and encouraging a balanced lifestyle.	English	24700000	2994726412	Howto & Style	Chloe Ting	412	Australia	AU	Howto	2897	2	7	23263000	5800	93100	69800	1100000	0	2011	Aug	17	1131	25766605	527	21844756	-25274398	133775136
241	KatyPerryVEVO	Katy Perry's official VEVO channel, where fans can find her colorful and theatrical music videos.	English	24600000	23755792542	Music	KatyPerryVEVO	175	United States	US	Music	82	74	75	88940000	22200	355800	266800	4300000	0	2009	Dec	13	882	328239523	147	270663028	3709024	-95712891
242	Mark Rober	Former NASA engineer turned YouTuber sharing creative science experiments, gadgets, and technology exploration.	English	24600000	3647987299	Science & Technology	Mark Rober	120	United States	US	Tech	2178	74	3	88625000	22200	354500	265900	4300000	0	2011	Oct	20	882	328239523	147	270663028	3709024	-95712891
243	1theK	A premier K-pop channel offering the latest music videos, performances, and exclusive content from Korean artists.	Korean	24500000	23962070944	Music	1theK	18950	South Korea	KR	Entertainment	79	6	67	105567000	26400	422300	316700	5100000	0	2011	Jan	31	943	51709098	415	42106719	35907757	127766922
244	Like Nastya AE	An extension of the Like Nastya universe, catering to an Arabic-speaking audience with dubbed content.	Arabic	24400000	12385924995	Entertainment	Like Nastya AE	658	United States	US	Entertainment	312	75	68	169865000	42500	679500	509600	8200000	0	2018	Dec	19	882	328239523	147	270663028	3709024	-95712891
245	Amit Bhadana	Delivers comedy sketches that highlight everyday situations with a humorous twist and relatable characters.	Hindi	24300000	2380248899	Entertainment	Amit Bhadana	17	India	IN	People	4054185		7710	5	0	2	2	24	0	2009	Dec	31	281	1366417754	536	471031528	20593684	7896288
246	Pen Movies	Channel featuring a variety of movies and series, catering to fans of diverse genres and languages.	NA	24300000	6608773195	Film & Animation	Pen Movies	1667	India	IN	Film	903	53	17	94853000	23700	379400	284600	4600000	0	2014	Mar	25	281	1366417754	536	471031528	20593684	7896288
247	MrBeast en Espana	The Spanish version of MrBeast's channel, offering translated content from his original channel.	Spanish	24200000	2700914170	Entertainment	MrBeast en Espagna	67	Mexico	MX	Entertainment	3309	10	70	33590000	8400	134400	100800	1600000	0	2021	Jul	9	402	126014024	342	102626859	23634501	-102552784
248	shfa show India	NA	NA	24200000	15724160183	People	shfa show India	469	United Arab Emirates	AE	People	203	3	9	151208000	37800	604800	453600	7300000	0	2019	Apr	1	368	9770529	235	8479744	23424076	53847818
249	Super JoJo - Nursery Rhymes & Kids Songs	Engaging children's content with catchy tunes, colorful animations, and educational themes.	English	24100000	329774870	Education	Super JoJo - Nursery Rhymes & Kids Songs	36	United States	US	Education	40117	77	15	328503000	82100	1300000	985500	15800000	0	2019	May	31	882	328239523	147	270663028	3709024	-95712891
250	Alejo Igoa	Delivers a mix of lifestyle, humor, and personal vlogs, creating a close bond with his audience.	Spanish	24100000	10999000479	Comedy	Alejo Igoa	802	Argentina	AR	Entertainment	376	4	71	401512000	100400	1600000	1200000	19300000	0	2014	Jan	17	900	44938712	979	41339571	-38416097	-63616672
251	Daniel LaBelle	A content creator known for his comedic and exaggerated silent skits about everyday situations.	English	24100000	12916159065	Comedy	Daniel LaBelle	287	United States	US	Comedy	290		14	398765000	99700	1600000	1200000	19100000	0	2009	Mar	11	882	328239523	147	270663028	3709024	-95712891
252	netd m	Turkish music platform providing a wide range of music videos and entertainment content.	Turkish	24100000	56106087508	Music	netd m?	23491	Turkey	TR	Music	14	2	76	424815000	106200	1700000	1300000	20400000	0	2014	Jan	23	239	83429615	1349	63097818	38963745	35243322
253	DJ Snake	The official channel of the French DJ and record producer featuring music videos and live sets.	English	24100000	8425505919	Music	DJ Snake	252	United States	US	Music	602	77	76	63293000	15800	253200	189900	3000000	0	2008	Sep	24	882	328239523	147	270663028	3709024	-95712891
254	Diana and Roma ARA	Arabic channel of the popular kid vloggers Diana and Roma featuring playful content and family adventures.	Arabic	24100000	11041261296	Entertainment	Diana and Roma ARA	590	United States	US	Entertainment	379	76	70	66884000	16700	267500	200700	3200000	0	2019	Feb	1	882	328239523	147	270663028	3709024	-95712891
255	KSI	British YouTuber turned boxer and musician known for his entertainment videos, music, and boxing matches.	English	24100000	6002166932	Entertainment	KSI	1252	United Kingdom	GB	Music	1053	10	76	5439000	1400	21800	16300	261100	0	2009	Jul	25	600	66834405	385	55908316	55378051	-3435973
256	Spider Slack	NA	NA	24000000	13943030228	Comedy	Spider Slack	901	Brazil	BR	Comedy	252	13	14	761451000	190400	3000000	2300000	36500000	0	2020	May	18	513	212559417	1208	183241641	-14235004	-5192528
257	Goldmines Movies	A hub for Bollywood movies offering a collection of classic and contemporary Indian films.	Hindi	24000000	5652938599	Film & Animation	Ti Ti	3	India	IN	People	4057888		7725	3	0	1	1	14	0	2018	Apr	30	281	1366417754	536	471031528	20593684	7896288
