738	Rclbeauty101	Creates beauty tutorials, DIY tips, and lifestyle vlogs.	English	14400000	3900312631	Comedy	Rclbeauty101	463	United States	US	Entertainment	1986	157	152	8636000	2200	34500	25900	414500	0	2010	Dec	14	882	328239523	147	270663028	3709024	-95712891
739	Coke Studio	Features live studio-recorded music performances by established and emerging artists from Pakistan.	Urdu	14400000	4035738731	Music	Rohail Hyatt	450	United States	US	Music	23796	962	836	3557000	889	14200	10700	170700	0	2008	Jun	4	882	328239523	147	270663028	3709024	-95712891
740	Indore Physical Academy	Focuses on providing training and educational content for physical fitness examinations in India.	Hindi	14400000	4156427797	People & Blogs	Indore Physical Academy	1838	India	IN	People	1793	107	47	70409000	17600	281600	211200	3400000	0	2014	Apr	19	281	1366417754	536	471031528	20593684	7896288
741	Rosanna Pansino	"Well-known for her ""Nerdy Nummies"" baking series where she creates desserts inspired by pop culture."	English	14400000	4597228794	Howto & Style	Rosanna Pansino	1248	United States	US	Howto	1552	157	27	26683000	6700	106700	80000	1300000	0	2010	Apr	8	882	328239523	147	270663028	3709024	-95712891
742	Harry Styles	Official channel of the British singer, featuring music videos, live performances, and behind-the-scenes content.	English	14400000	5689224452	People & Blogs	harrystyles	0	United States	US	Games	4037956	7574	7340		0	0	0	0	0				882	328239523	147	270663028	3709024	-95712891
743	Vlad and Niki PRT	Portuguese version of the popular children's channel featuring two brothers engaging in imaginative play.	Portuguese	14400000	6543282459	Entertainment	Vlad and Niki PRT	516	United States	US	Entertainment	918	157	152	40089000	10000	160400	120300	1900000	0	2018	Nov	3	882	328239523	147	270663028	3709024	-95712891
744	RS 1313 SHORTS	Features short comedic sketches and pranks, generally light-hearted and entertaining content.	Hindi	14400000	8011977288	Entertainment	RS 1313 SHORTS	5628	India	IN	Entertainment	647	108	152	212639000	53200	850600	637900	10200000	0	2020	Oct	24	281	1366417754	536	471031528	20593684	7896288
745	Zig & Sharko	Animated series channel featuring the comedic antics of Zig the hyena and Sharko the shark.	Multiple	14400000	9023952946	Film & Animation	Zig & Sharko	978	France	FR	Film	534		39	62689000	15700	250800	188100	3000000	0	2015	May	6	656	67059887	843	54123364	46227638	2213749
746	SelenaGomezVEVO	Official Vevo channel for the American artist Selena Gomez, hosting her music videos and live performance clips.	English	14400000	11423792969	Music	SelenaGomezVEVO	186	United States	US	Music	354	157	133	88657000	22200	354600	266000	4300000	0	2009	Nov	24	882	328239523	147	270663028	3709024	-95712891
747	ZEE5	Digital platform offering web series, Indian TV shows, anime, and more, primarily in Hindi and other regional languages.	Hindi	14400000	18515587421	Entertainment	ZEE5	101401	India	IN	Entertainment	142	108	152	149799000	37400	599200	449400	7200000	0	2018	Feb	13	281	1366417754	536	471031528	20593684	7896288
748	Super Polina	Russian children's channel featuring a young girl, Polina, engaging in playful activities and family fun adventures.	Russian	14300000	4776507159	People & Blogs	Super Polina	576	United States	US	Entertainment	1452	158	153	413774	103	1700	1200	19900	0	2014	Jul	8	882	328239523	147	270663028	3709024	-95712891
749	Rebecca Zamolo	Creates family-friendly content, game challenges, and mystery series alongside her friends and family.	English	14300000	6388439235	Comedy	RebeccaZamolo	1	United States	US	Entertainment	4054606	6342	5464		0	0	0	0	0	2011	Aug	4	882	328239523	147	270663028	3709024	-95712891
750	Wish 107.5	Known for its unique format where artists perform inside a moving bus, featuring live performances predominantly from the Philippines.	English	14200000	6048517979	Music	Wish 107.5	1823	Philippines	PH	Music	1036	8	134	62658000	15700	250600	188000	3000000	0	2014	Jul	13	355	108116615	215	50975903	12879721	121774017
751	Invento na Hora	Brazilian channel featuring comedy sketches, challenges, and personal vlogs.	Portuguese	14200000	4040297006	Film & Animation	Invento na Hora	1281	Brazil	BR	Entertainment	1877	43	154	19029000	4800	76100	57100	913400	0	2014	Oct	18	513	212559417	1208	183241641	-14235004	-5192528
752	SIS vs BRO	Sibling duo known for their challenges, slime videos, and personal vlogs.	English	14200000	6973932553	Entertainment	SiS	60	Ukraine	UA	Entertainment	3739171	2460	4686	105	3	42	32	5	0	2016	Aug	3	827	44385155	888	30835699	48379433	3116558
753	NikkieTutorials	Famous for makeup tutorials and beauty tips, including transformative makeup techniques.	English	14200000	1778318927	Howto & Style	NikkieTutorials	876	Netherlands	NL	Howto	5764	2	154	35934000	9000	143700	107800	1700000	0	2008	Jun	23	850	17332850	32	15924729	52132633	5291266
754	TommyInnit	Popular British Minecraft streamer and YouTuber known for his humorous and energetic videos.	English	14200000	2084791147	Gaming	TommyInnit	342	United Kingdom	GB	Games	4696	27	55	54291000	13600	217200	162900	2600000	0	2015	Dec	24	600	66834405	385	55908316	55378051	-3435973
755	E-MasterSensei	"Focuses on mobile gaming content, especially ""Free Fire"" tips, tricks, and gameplay."	Spanish	14200000	3920559552	Gaming	E-MasterSensei	1300	Mexico	MX	Games	1971	28	54	44575000	11100	178300	133700	2100000	0	2016	Jan	13	402	126014024	342	102626859	23634501	-102552784
756	infobells - Kannada	Offers a range of educational and entertaining content for children in Kannada, including rhymes and stories.	Kannada	14200000	6554000320	Education	infobells - Kannada	433	India	IN	Education	912	110	37	141688000	35400	566800	425100	6800000	0	2014	Mar	13	281	1366417754	536	471031528	20593684	7896288
757	Crazy Frog	"Channel dedicated to the animated character ""Crazy Frog,"" featuring music videos and animated shorts."	English	14200000	7946322061	Music	CrazyFrog	0	Sweden	SE	Games	4057944		7453		0	0	0	0	0	2005	Oct	2	670	10285453	648	9021165	60128161	18643501
758	The Dodo	Focuses on animal rescue and rehabilitation stories with heartwarming and inspiring content.	English	14200000	9964116817	Pets & Animals	Dorukhan G???	8	United States	US		4050736			7208	2	29	22	346	0	2006	Jun	14	882	328239523	147	270663028	3709024	-95712891
759	SEVENGERS	Gaming channel with a focus on mobile games, providing gameplay, tips, and reviews.	English	14200000	10238593147	Comedy	SEVENGERS	872	India	IN	Comedy	422	110	33	367898000	92000	1500000	1100000	17700000	0	2018	Jun	4	281	1366417754	536	471031528	20593684	7896288
760	Zee Bangla	Offers a variety of Bangla-language TV shows, series, and cultural programming from the West Bengal region.	Bengali	14200000	11428794827	Entertainment	Zee Bangla	132398	India	IN	Entertainment	352	109	153	59927000	15000	239700	179800	2900000	0	2008	Feb	26	281	1366417754	536	471031528	20593684	7896288
761	DangMattSmith	Known for his reaction videos, comedy sketches, and engaging with viral trends.	English	14200000	3317805543	Entertainment	DangMattSmith	1724	United States	US	Entertainment	2485	159	154	12902000	3200	51600	38700	619300	0	2011	Aug	18	882	328239523	147	270663028	3709024	-95712891
762	Neha Kakkar	Indian singer featuring her music videos, live performances, and behind-the-scenes footage.	Hindi	14100000	2131548711	Music	Neha Kakkar	149	India	IN	Music	4624	110	134	25605000	6400	102400	76800	1200000	0	2012	Oct	22	281	1366417754	536	471031528	20593684	7896288
763	Refugio Mental	Features interesting facts, trivia, and educational content in an engaging format.	Spanish	14100000	3594936775	Entertainment	Refugio Mental	846	Spain	ES	Entertainment	2218		155	6942000	1700	27800	20800	333200	0	2013	Aug	10	889	47076781	1396	37927409	40463667	-374922
764	Trap City	One of the leading channels promoting trap and bass music, featuring new songs and artists.	English	14100000	5129529846	Music	TrapCity	3	Australia	AU	People	4032620	3671	7629	147	4	59	44	7	0	2015	Nov	4	1131	25766605	527	21844756	-25274398	133775136
765	Supercar Blondie	Reviews and showcases luxury and supercars, providing insights and vlogs from automotive events.	English	14100000	5405563355	Autos & Vehicles	Supercar Blondie	855	United Arab Emirates	AE	Autos	1202	7	1	353259000	88300	1400000	1100000	17000000	0	2007	Sep	12	368	9770529	235	8479744	23424076	53847818
766	Yudist Ardhana	Indonesian content creator known for his vlogs, pranks, and social experiments.	Indonesian	14100000	6036496916	Entertainment	Yudist Ardhana	2854	Indonesia	ID	Entertainment	1029	27	154	176062000	44000	704200	528200	8500000	0	2016	Jan	6	363	270203917	469	151509724	-789275	113921327
767	Lana Del Rey	Official channel of the American singer-songwriter, featuring her music videos, live performances, and visual content.	English	14100000	6884215292	Music	Lana Del Rey	43	United States	US	Music	856	160	135	135563000	33900	542300	406700	6500000	0	2011	May	5	882	328239523	147	270663028	3709024	-95712891
768	MalumaVEVO	Hosts official music videos, interviews, and live performances from the Colombian singer Maluma.	Spanish	14100000	19013942981	Music	MalumaVEVO	182	United States	US	Music	138	160	135	98834000	24700	395300	296500	4700000	0	2011	Jun	15	882	328239523	147	270663028	3709024	-95712891
769	F2Freestylers - Ultimate Soccer Skills Channel	Features soccer tutorials, skills, tricks, and challenges featuring skilled freestylers.	English	14100000	3280481927	Sports	F2Freestylers - Ultimate Soccer Skills Chann?	777	United Kingdom	GB	Sports	2530	28	10	10222000	2600	40900	30700	490600	0	2011	Apr	9	600	66834405	385	55908316	55378051	-3435973
770	Bie The Ska	Thai YouTuber known for his comedic sketches, parodies, and challenge videos.	Thai	14100000	4627069704	Entertainment	Bie The Ska	1540	Thailand	TH	Entertainment	1531	14	155	12502000	3100	50000	37500	600100	0	2006	Oct	3	493	69625582	75	35294600	15870032	100992541
771	AM3NlC	Brazilian YouTuber known for Minecraft gameplay and other gaming content.	Portuguese	14000000	4959982720	Gaming	AM3NlC	5757	Brazil	BR	People	1392	45	49	10210000	2600	40800	30600	490100	0	2012	Dec	15	513	212559417	1208	183241641	-14235004	-5192528
772	Narins Beauty	Syrian YouTuber creating beauty tutorials, fashion hauls, and lifestyle vlogs.	Arabic	14000000	2214167846	Howto & Style	Narins Beauty	431	Sweden	SE	Howto	4325	3	156	13709000	3400	54800	41100	658000	0	2014	Sep	24	670	10285453	648	9021165	60128161	18643501
773	TV Ana Emilia	Mexican children's channel featuring songs, challenges, and family-friendly content.	Spanish	14000000	4674164601	People & Blogs	TV Ana Emilia	651	Mexico	MX	Entertainment	1504	29	156	26783000	6700	107100	80300	1300000	0	2014	Dec	30	402	126014024	342	102626859	23634501	-102552784
774	Luli Pampii	Produces children?s entertainment content, focusing on songs and playful learning.	Spanish	14000000	8623705301	Music	Luli Pampii	294	Spain	ES	Music	579	15	136	201659000	50400	806600	605000	9700000	0	2012	Dec	22	889	47076781	1396	37927409	40463667	-374922
775	Gallina Pintadita	Popular Brazilian channel for children featuring animated songs and stories.	Portuguese	14000000	9660950823	Music	Gallina Pintadita	62	Mexico	MX	Film	477	29	40	70626000	17700	282500	211900	3400000	0	2011	Aug	2	402	126014024	342	102626859	23634501	-102552784
776	ViralHog	Distributes viral videos and clips covering a wide range of activities and events globally.	English	14000000	18917687143	People & Blogs	ViralHog	41117	United States	US	Animals	136	159	3	1364000000	340900	5500000	4100000	65500000	0	2014	Aug	22	882	328239523	147	270663028	3709024	-95712891
777	ETV Jabardasth	Indian channel known for its comedy shows and entertainment programming.	Telugu	14000000	13542939513	People & Blogs	ETV Jabardasth	9652	India	IN	Comedy	268	111	34	133584000	33400	534300	400800	6400000	0	2015	Jul	14	281	1366417754	536	471031528	20593684	7896288
778	Zee Telugu	Offers a variety of serials, reality shows, and other entertainment in Telugu.	Telugu	14000000	12597067132	Entertainment	zeetelugu	3	India	IN	Music	4039216	4651	4603	7	0	3	2	34	0	2007	Jan	31	281	1366417754	536	471031528	20593684	7896288
779	Crescendo com Luluca	Brazilian children's channel with vlogs, challenges, and lifestyle content.	Portuguese	14000000	5094050461	Entertainment	Crescendo com Luluca	1307	Brazil	BR	People	1327	44	48	68058000	17000	272200	204200	3300000	0	2015	Aug	30	513	212559417	1208	183241641	-14235004	-5192528
780	Jazzghost	Brazilian YouTuber who focuses on Minecraft gameplay and other gaming content.	Portuguese	13900000	5673347763	Gaming	Jazzghost	5494	Brazil	BR	Games	1140	46	57	106718000	26700	426900	320200	5100000	0	2012	Aug	30	513	212559417	1208	183241641	-14235004	-5192528
781	karameeshchannel	Arabic channel featuring children's songs and entertainment content.	Arabic	13900000	9106781518	Entertainment	karameeshchannel	2254	Jordan	JO	Music	526	3	137	87639000	21900	350600	262900	4200000	0	2012	Jan	18	344	10101694	1472	9213048	30585164	36238414
782	Darkar Company Studios	Channel known for animated web series and comedy sketches.	Spanish	13900000	2244318380	Film & Animation	Darkar Company Studios	183	United States	US	Comedy	4234	161	35	4598000	1100	18400	13800	220700	0	2009	Feb	15	882	328239523	147	270663028	3709024	-95712891
783	Dental Digest	YouTube channel dedicated to testing and reviewing dental products through engaging experiments.	English	13900000	7450345720	People & Blogs	Dental Digest	324	United States	US	People	745		50	231562000	57900	926200	694700	11100000	0	2020	Aug	12	882	328239523	147	270663028	3709024	-95712891
784	T-Series Regional	Subsidiary of T-Series providing regional music and film content from different parts of India.	Multiple Indian languages	13900000	5217553897	Entertainment	T-Series Regional	15075	India	IN	Music	1275	111	136	33484000	8400	133900	100500	1600000	0	2011	Feb	14	281	1366417754	536	471031528	20593684	7896288
785	ADEL et SAMI	French channel featuring pranks, challenges, and vlogs by two brothers.	French	13900000	5465532801	Entertainment	ADEL et SAMI	503	United States	US	Entertainment	1200	161	157	26883000	6700	107500	80600	1300000	0	2018	Mar	12	882	328239523	147	270663028	3709024	-95712891
786	Jamuna TV	Bangladeshi news channel providing national news, updates, and documentaries.	Bengali	13900000	12129583055	News & Politics	jamuna tv24	6	Bangladesh	BD	Entertainment	4056658	3776	6756	1	0	0	0	5	0	2021	Feb	10	206	167310838	419	60987417	23684994	90356331
787	Atlantic Records	Official channel of the American record label featuring music videos and artist content.	English	13900000	12513842343	Music	Atlantic Records	1660	United States	US	Music	307	161	137	97284000	24300	389100	291900	4700000	0	2006	Dec	15	882	328239523	147	270663028	3709024	-95712891
788	Veritasium	Educational channel that explores science, education, and other interesting factual content.	English	13900000	2165885634	Education	Veritasium	369	United States	US	Education	4466	161	38	44149000	11000	176600	132400	2100000	0	2010	Jul	21	882	328239523	147	270663028	3709024	-95712891
789	Alexa Rivera	Social media influencer known for her challenge videos, pranks, and vlogs.	English	13900000	3193226072	Howto & Style	Alexa Rivera	288	United States	US	Howto	2613		157	142760000	35700	571000	428300	6900000	0	2010	Aug	21	882	328239523	147	270663028	3709024	-95712891
790	Airrack	YouTube creator known for his challenge videos, pranks, and high-energy content.	English	13800000	2224911030	Entertainment	Airrack	173	United States	US	Entertainment	4285	161	157	99654000	24900	398600	299000	4800000	0	2015	Jan	3	882	328239523	147	270663028	3709024	-95712891
791	Hacksmith Industries	Channel known for engineering challenges and building real-world versions of movie gadgets.	English	13800000	1820559912	Science & Technology	Hacksmith Industries	887	Canada	CA	Tech	5524	10	14	83943000	21000	335800	251800	4000000	0	2006	Apr	20	689	36991981	556	30628482	56130366	-106346771
792	JD Pantoja	Mexican musician and social media star producing music videos and personal vlogs.	Spanish	13800000	1493776391	People & Blogs	JD Pantoja	16	Mexico	MX	Music	7134		138	13533000	3400	54100	40600	649600	0	2017	Jun	5	402	126014024	342	102626859	23634501	-102552784
793	Atro	"Gaming channel focused on ""Minecraft"" content, including tutorials and gameplay."	English	13800000	2480957682	Gaming	Atro	1952	Netherlands	NL	Games	3690	4	58	55122000	13800	220500	165400	2600000	0	2017	Jul	2	85	17332850	32	15924729	52132633	5291266
794	123 GO! Spanish	Spanish version of the popular DIY and life hacks channel, offering creative and fun ideas.	Spanish	13800000	5019136690	People & Blogs	123 GO! Spanish	520	Mexico	MX	Howto	1361	30	28	26519000	6600	106100	79600	1300000	0	2019	Mar	13	402	126014024	342	102626859	23634501	-102552784
795	Geo News	Leading news channel in Pakistan offering news updates, political news, and current affairs.	Urdu	13800000	5727888539	News & Politics	Geo News	190093	Pakistan	PK	News	1127	6	21	100053000	25000	400200	300200	4800000	0	2007	Jan	10	90	216565318	445	79927762	30375321	69345116
796	Kids TV India Hindi Nursery Rhymes	Channel producing animated nursery rhymes and children's songs in Hindi.	Hindi	13800000	6646953396	Shows	Kids TV India Hindi Nursery Rhymes	1505	India	IN	Education	898	112	38	78651000	19700	314600	236000	3800000	0	2014	Nov	17	281	1366417754	536	471031528	20593684	7896288
797	Think Music India	Tamil music channel featuring film soundtracks, singles, and music videos.	Tamil	13800000	11039343563	Music	Think Music India	4978	India	IN	Music	374	112	137	217106000	54300	868400	651300	10400000	0	2009	Aug	15	281	1366417754	536	471031528	20593684	7896288
798	O Que Nii	Brazilian channel featuring entertainment content, pranks, and challenges.	Portuguese	13700000	1967930734	Comedy	O Que Nii	696	Brazil	BR	Entertainment	5035	47	159	87804000	22000	351200	263400	4200000	0	2015	Feb	6	513	212559417	1208	183241641	-14235004	-5192528
799	Goldmines Premiere	Channel known for premiering new and popular Indian films and series.	Hindi	13700000	1973638757	Entertainment	Goldmines Premiere	975	India	IN	Film	5047	113	41	37648000	9400	150600	112900	1800000	0	2013	Oct	12	281	1366417754	536	471031528	20593684	7896288
800	MAIKI021	Brazilian gaming YouTuber known for his humorous and engaging gaming videos.	Portuguese	13700000	1950178163	Entertainment	MAIKI021	3298	Brazil	BR	Entertainment	5135	47	159	7438000	1900	29800	22300	357000	0	2008	Jan	22	513	212559417	1208	183241641	-14235004	-5192528
801	The Vishal bhatt	Indian lifestyle and fitness influencer sharing tips, vlogs, and personal experiences.	Hindi	13700000	9596430464	Comedy	The Vishal bhatt	1040	India	IN	Comedy	487	113	36	379240000	94800	1500000	1100000	18200000	0	2021	Aug	15	281	1366417754	536	471031528	20593684	7896288
802	NishaMadhulika	Popular Indian chef sharing vegetarian cooking recipes and kitchen tips.	Hindi	13700000	2939201386	Howto & Style	NishaMadhulika	2158	India	IN	Howto	2972	113	29	22235000	5600	88900	66700	1100000	0	2009	Aug	2	281	1366417754	536	471031528	20593684	7896288
803	MyMissAnand	Young Indian YouTuber creating comedic sketches and challenge videos.	Hindi	13700000	4963275018	People & Blogs	MyMissAnand	340	India	IN	Entertainment	1387	113	159	27882000	7000	111500	83600	1300000	0	2014	Jul	22	281	1366417754	536	471031528	20593684	7896288
804	FAPTV	Vietnamese entertainment channel known for its original series and comedic sketches.	Vietnamese	13700000	5457203710	Comedy	FAPTV	863	Vietnam	VN	Comedy	1205	3	36	35124000	8800	140500	105400	1700000	0	2014	Feb	26	285	96462106	201	35332140	14058324	108277199
805	Wesley Safadii	Brazilian content creator producing a variety of entertainment videos.	Portuguese	13700000	8134379376	Music	Wesley Safadii	438	Brazil	BR	Music	631	47	139	64059000	16000	256200	192200	3100000	0	2009	Jun	21	513	212559417	1208	183241641	-14235004	-5192528
806	infobells	Produces animated educational content for children in various Indian languages.	Multiple Indian languages	13700000	5178142148	Education	infobells	495	India	IN	Education	1289	113	39	23893000	6000	95600	71700	1100000	0	2011	Oct	20	281	1366417754	536	471031528	20593684	7896288
807	Desi Gamers	"Gaming channel with a focus on ""Free Fire"" gameplay videos and gaming tips."	Hindi	13700000	2135195239	Gaming	Desi gamers	1	India	IN	Tech	4057849		4183	5	0	2	2	24	0	2020	Apr	14	281	1366417754	536	471031528	20593684	7896288
808	Acenix	"Spanish gaming YouTuber known for his ""Minecraft"" survival series and other gaming content."	Spanish	13600000	2122062016	Gaming	Acenix	368	Spain	ES	Games	4572	16	60	47436000	11900	189700	142300	2300000	0	2014	Jan	2	889	47076781	1396	37927409	40463667	-374922
809	Zeinab Harake	Filipino vlogger known for her personal vlogs, challenges, and family content.	Tagalog	13600000	896891351	People	Zeinab Harake	273	Philippines	PH	People	13437	9	51	12088000	3000	48400	36300	580200	0	2017	Oct	19	355	108116615	215	50975903	12879721	121774017
810	DALLMYD	YouTuber known for river diving and treasure hunting videos, exploring underwater secrets.	English	13600000	1948925559	Sports	DALLMYD	412	United States	US	Sports	5133	164	11	30677000	7700	122700	92000	1500000	0	2011	Feb	1	882	328239523	147	270663028	3709024	-95712891
811	Lindsey Stirling	Violinist and dancer known for her cinematic music videos and eclectic musical style.	English	13600000	3764608356	Music	Lindsey Stirling	199	United States	US	Music	2084	163	139	15277000	3800	61100	45800	733300	0	2007	May	20	882	328239523	147	270663028	3709024	-95712891
812	JOJO TV - Hindi Stories	Indian channel producing animated stories and educational content for children.	Hindi	13600000	5141201173	Education	JOJO TV - Hindi Stories	1097	India	IN	Film	1303	114	42	10764000	2700	43100	32300	516700	0	2016	Dec	25	281	1366417754	536	471031528	20593684	7896288
813	BBC	Official channel of the British Broadcasting Corporation offering news, documentaries, and more.	English	13600000	9685060624	Pets & Animals	BBC	16047	United Kingdom	GB	Entertainment	474	29	160	44414000	11100	177700	133200	2100000	0	2005	Nov	12	600	66834405	385	55908316	55378051	-3435973
814	Saturday Night Live	Official channel of the SNL television show featuring clips from the latest episodes and classics.	English	13600000	14717282742	Entertainment	Saturday Night Live	8335	United States	US	Comedy	232	164	37	56626000	14200	226500	169900	2700000	0	2013	Jul	23	882	328239523	147	270663028	3709024	-95712891
815	BUDI01 GAMING	"Indonesian gaming YouTuber known for his ""Minecraft"" and other gaming content."	Indonesian	13500000	1181292450	Gaming	BUDI01 GAMING	319	Indonesia	ID	Games	9540	29	61	13436000	3400	53700	40300	644900	0	2019	Jul	19	363	270203917	469	151509724	-789275	113921327
816	Typical Gamer	"Gamer known for live streaming ""Fortnite"" and other popular video games."	English	13500000	4301581610	Gaming	Typical Gamer	4312	Canada	CA	Games	1716	11	61	32557000	8100	130200	97700	1600000	0	2008	Aug	24	689	36991981	556	30628482	56130366	-106346771
817	Anaysa	Indian beauty and lifestyle channel featuring DIY, fashion, and makeup tutorials.	Hindi	13500000	3445794123	Howto & Style	Anaysa	591	India	IN	Howto	2364	115	30	29706000	7400	118800	89100	1400000	0	2012	Mar	10	281	1366417754	536	471031528	20593684	7896288
818	JULIA GISELLA	Focuses on creating art and drawings, often featuring celebrity portraits and fan art.	English	13500000	5380132790	Entertainment	Julia Gisella	19	United Kingdom	GB	Music	3767960	2492	3189	1615	4	6	5	78	0	2015	Mar	24	600	66834405	385	55908316	55378051	-3435973
819	Awakening Music	Record label producing music videos for spiritual and inspirational music from Muslim artists.	Arabic	13500000	5545936485	Music	Awakening Music	814	United Kingdom	GB	Music	1183	30	140	35309000	8800	141200	105900	1700000	0	2006	Dec	25	600	66834405	385	55908316	55378051	-3435973
820	Lady Diana	Channel featuring toy unboxing and reviews, primarily targeting young children and families.	English	13500000	8265920659	Entertainment	Lady Diana	1403	Ukraine	UA	People	620	4	52	75162000	18800	300600	225500	3600000	0	2016	Mar	21	827	44385155	888	30835699	48379433	3116558
821	Sanjoy Das Official	Indian musician producing music tutorials, lessons, and performances on various instruments.	Hindi	13500000	3912334359	Entertainment	Sanjoy Das Official	1793	India	IN	Games	1954	114	60	179232000	44800	716900	537700	8600000	0	2015	Apr	29	281	1366417754	536	471031528	20593684	7896288
822	Woody & Kleiny	British duo known for their pranks, challenges, and comedic sketches.	English	13500000	11717217293	Comedy	Woody & Kleiny	975	United Kingdom	GB	Entertainment	333	29	160	495561000	123900	2000000	1500000	23800000	0	2013	Mar	30	600	66834405	385	55908316	55378051	-3435973
823	Vijay Kumar Viner Vlogs	Indian vlogger sharing his daily life, travel vlogs, and personal experiences.	Hindi	13500000	7958771872	Entertainment	Vijay Kumar Viner Vlogs	1357	India	IN	Entertainment	663	116	162	109813000	27500	439300	329400	5300000	0	2019	Mar	22	281	1366417754	536	471031528	20593684	7896288
824	Conor Maynard	British singer and songwriter known for his music covers and original songs.	English	13500000	2750993392	Music	Conor Maynard	321	United States	US	Music	3257	165	140	10787000	2700	43100	32400	517800	0	2006	May	19	882	328239523	147	270663028	3709024	-95712891
825	Wengie	Australian-Chinese creator known for DIYs, life hacks, and music videos.	English	13500000	1900272833	Howto & Style	Wengie	462	United States	US	Howto	5297	165	30	1335000	334	5300	4000	64100	0	2010	Sep	9	882	328239523	147	270663028	3709024	-95712891
826	Vlad y Niki Show	Spanish-language version of the popular children?s channel featuring two brothers' adventures.	Spanish	13400000	4622628957	Entertainment	Vlad y Niki Show	477	United States	US	Entertainment	1537	166	162	92228000	23100	368900	276700	4400000	0	2018	Nov	8	882	328239523	147	270663028	3709024	-95712891
